"Ashanti","Ashanti","2002","Grammy for Contemporary R&B","https://www.discogs.com/master/42027","39455","Funk / Soul; Hip Hop; Pop","Contemporary R&B"
"Dangerously In Love","Beyoncé","2003","Grammy for Contemporary R&B","https://www.discogs.com/master/41127","52835","Funk / Soul","Contemporary R&B"
"Confessions","Usher","2004","AMA for Pop/Rock; AMA for Soul/R&B; Grammy for Contemporary R&B","https://www.discogs.com/master/136803","97139","Funk / Soul","Contemporary R&B"
"The Emancipation Of Mimi","Mariah Carey","2005","Grammy for Contemporary R&B","https://www.discogs.com/master/78958","33534","Funk / Soul","Contemporary R&B"
"B'Day","Beyoncé","2006","Grammy for Contemporary R&B","https://www.discogs.com/master/41244","52835","Funk / Soul","Contemporary R&B"
"Because Of You","Ne-Yo","2007","Grammy for Contemporary R&B","https://www.discogs.com/master/155999","359939","Funk / Soul; Hip Hop","Contemporary R&B"
"Growing Pains","Mary J. Blige","2007","Grammy for Contemporary R&B","https://www.discogs.com/master/165690","4778","Funk / Soul","Contemporary R&B"
"I Am... Sasha Fierce","Beyoncé","2008","Grammy for Contemporary R&B","https://www.discogs.com/master/41680","52835","Funk / Soul; Pop","Ballad; Contemporary R&B"
"Raymond V Raymond","Usher","2010","AMA for Soul/R&B; Grammy for Contemporary R&B","https://www.discogs.com/master/269237","97139","Electronic; Funk / Soul; Hip Hop; Pop","Contemporary R&B; Pop Rap"
